{
  "artifact": {
    "id": "policy-anthropic-2026-04-20-april-20-2026-25307862",
    "version": 1,
    "source_stage": "policy_engine",
    "next_stage": "ticketing",
    "status": "ready",
    "owner_agent": "Policy Engine",
    "created_at": "2026-04-22T12:00:00Z",
    "updated_at": "2026-04-22T12:00:00Z",
    "risk_tier": "medium",
    "execution_lane": "restricted",
    "policy_decision_id": "policy-anthropic-2026-04-20-april-20-2026-25307862",
    "budget_class": "large",
    "rollback_class": "manual_recovery_required",
    "approval_requirements": [
      "security",
      "merge",
      "release"
    ]
  },
  "spec_packet_id": "spec-anthropic-2026-04-20-april-20-2026-25307862",
  "decision": "active_build_candidate",
  "risk_score": 35,
  "lane_assignment": {
    "lane": "restricted",
    "locked": true,
    "hard_override_reason": "external_api_contract_change"
  },
  "required_eval_tiers": [
    "pr_smoke",
    "pre_merge",
    "nightly",
    "post_deploy"
  ],
  "autonomy_policy": {
    "merge": "human_required",
    "deploy": "human_required",
    "rollback": "human_on_exception"
  },
  "budget_policy": {
    "max_pr_review_cycles": 5,
    "max_token_budget_usd": 150,
    "max_concurrent_work_items": 2
  },
  "deployment_policy": {
    "feature_flag_required": true,
    "strategy": "staged_rollout_with_signoff",
    "minimum_soak_minutes": 1440,
    "minimum_request_samples": 3000,
    "auto_promote_allowed": false
  },
  "required_approvals": [
    "security",
    "merge",
    "release"
  ],
  "reasoning": [
    "Direct integration signal detected (tool, response format), so this item is concrete enough for the build queue.",
    "Affected surfaces identified in Stage 1: api_contract, tool_runtime.",
    "Open questions captured: 1, all currently marked non-blocking."
  ]
}
