{
  "artifact": {
    "id": "policy-watch-001",
    "version": 1,
    "source_stage": "policy_engine",
    "next_stage": "completed",
    "status": "approved",
    "risk_tier": "medium",
    "owner_agent": "Policy Engine",
    "policy_decision_id": "policy-watch-001",
    "rollback_class": "none",
    "approval_requirements": [],
    "created_at": "2026-04-22T13:00:00Z",
    "updated_at": "2026-04-22T13:00:00Z"
  },
  "spec_packet_id": "spec-watch-001",
  "decision": "watchlist",
  "risk_score": 35,
  "required_approvals": [],
  "reasoning": [
    "The feature is relevant enough to monitor but not scoped enough for active implementation.",
    "Cross-repo implications push it outside the current MVP lane."
  ]
}
